{
  "$schema": "https://json-schema.org/draft/2020-12/schema",
  "description": "Schéma FIGÉ de la source `refunds`, inféré depuis 4 enregistrement(s) puis RELU (identifiants dé-énumérés, listes closes complétées, champs nullables typés, descriptions métier). C'est lui qui fait foi, pas les données : un champ absent d'ici est omis de la sortie de l'outil, et un écart de type au démarrage est [DATA_SOURCE_SCHEMA_DRIFT].",
  "properties": {
    "amount": {
      "description": "Montant remboursé, EUR, chaîne à deux décimales (partiel possible).",
      "type": "string"
    },
    "claim_id": {
      "description": "Réclamation à l'origine du remboursement (CLM-NNNN).",
      "type": "string"
    },
    "currency": {
      "description": "Devise — toujours EUR.",
      "enum": [
        "EUR"
      ],
      "type": "string"
    },
    "customer_id": {
      "description": "Client remboursé (CUST-NNNN). Filtre d'identité ; non énumérable.",
      "type": "string"
    },
    "method": {
      "description": "Moyen de versement — toujours celui du paiement d'origine : card, paypal, bank_transfer, gift_card.",
      "type": "string",
      "enum": [
        "card",
        "paypal",
        "bank_transfer",
        "gift_card"
      ]
    },
    "order_id": {
      "description": "Commande concernée.",
      "type": "string"
    },
    "payment_id": {
      "description": "Paiement d'origine sur lequel le remboursement est ou sera versé.",
      "type": "string"
    },
    "processed_at": {
      "description": "Date du versement, UTC ISO 8601. null tant que non versé — ne jamais promettre de date.",
      "format": "date-time",
      "type": [
        "string",
        "null"
      ]
    },
    "reason": {
      "description": "Motif : cancelled_before_shipping, lost_in_transit, missing_item, returned_to_sender, late_delivery, damaged…",
      "type": "string"
    },
    "refund_id": {
      "description": "Identifiant du remboursement (RFD-NNNN).",
      "type": "string"
    },
    "requested_at": {
      "description": "Date de la demande, UTC ISO 8601.",
      "format": "date-time",
      "type": "string"
    },
    "status": {
      "description": "requested, approved (validé, non versé), processed (versé), rejected.",
      "type": "string",
      "enum": [
        "requested",
        "approved",
        "processed",
        "rejected"
      ]
    }
  },
  "required": [
    "amount",
    "claim_id",
    "currency",
    "customer_id",
    "method",
    "order_id",
    "payment_id",
    "processed_at",
    "reason",
    "refund_id",
    "requested_at",
    "status"
  ],
  "title": "refunds",
  "type": "object",
  "x-sdda": {
    "generator": "gen_source_tools.py --infer",
    "recordsObserved": 4,
    "reviewed": true,
    "sourceId": "refunds",
    "reviewedBy": "Tech Lead — workspace/assets/_generate.py est la SSoT des valeurs"
  }
}
