[
  {
    "refund_id": "RFD-0001",
    "order_id": "305",
    "customer_id": "CUST-0002",
    "claim_id": "CLM-0002",
    "payment_id": "PAY-0006",
    "amount": "349.00",
    "currency": "EUR",
    "method": "card",
    "reason": "cancelled_before_shipping",
    "status": "processed",
    "requested_at": "2026-09-09T16:00:00Z",
    "processed_at": "2026-09-12T09:00:00Z"
  },
  {
    "refund_id": "RFD-0002",
    "order_id": "312",
    "customer_id": "CUST-0005",
    "claim_id": "CLM-0003",
    "payment_id": "PAY-0013",
    "amount": "149.00",
    "currency": "EUR",
    "method": "card",
    "reason": "lost_in_transit",
    "status": "approved",
    "requested_at": "2026-09-19T15:00:00Z",
    "processed_at": null
  },
  {
    "refund_id": "RFD-0003",
    "order_id": "313",
    "customer_id": "CUST-0005",
    "claim_id": "CLM-0004",
    "payment_id": "PAY-0014",
    "amount": "12.90",
    "currency": "EUR",
    "method": "card",
    "reason": "missing_item",
    "status": "processed",
    "requested_at": "2026-09-14T10:00:00Z",
    "processed_at": "2026-09-16T10:00:00Z"
  },
  {
    "refund_id": "RFD-0004",
    "order_id": "309",
    "customer_id": "CUST-0004",
    "claim_id": "CLM-0006",
    "payment_id": "PAY-0010",
    "amount": "89.00",
    "currency": "EUR",
    "method": "gift_card",
    "reason": "returned_to_sender",
    "status": "processed",
    "requested_at": "2026-09-19T10:00:00Z",
    "processed_at": "2026-09-20T10:00:00Z"
  }
]
